{
  "schemaVersion": 1,
  "nodeVersion": "22.22.3",
  "pythonVersion": "3.12.14",
  "pythonBuildRelease": "20260901",
  "requiredPythonCommands": [
    "coop-data-doc",
    "coop-sql-review",
    "coop-dax-review",
    "fab"
  ],
  "sources": {
    "darwin-arm64": {
      "file": "node-v22.22.3-darwin-arm64.tar.gz",
      "url": "https://nodejs.org/download/release/v22.22.3/node-v22.22.3-darwin-arm64.tar.gz",
      "sha256": "0da7ff74ef8611328c8212f17943368713a2ad953fb7d89a8c8a0eae87c23207",
      "archive": "tar.gz",
      "root": "node-v22.22.3-darwin-arm64"
    },
    "darwin-x64": {
      "file": "node-v22.22.3-darwin-x64.tar.gz",
      "url": "https://nodejs.org/download/release/v22.22.3/node-v22.22.3-darwin-x64.tar.gz",
      "sha256": "45830ba752fa0d892c6dcd640946669801293cac820a33591ded40ac075198ec",
      "archive": "tar.gz",
      "root": "node-v22.22.3-darwin-x64"
    },
    "win32-x64": {
      "file": "node-v22.22.3-win-x64.zip",
      "url": "https://nodejs.org/download/release/v22.22.3/node-v22.22.3-win-x64.zip",
      "sha256": "6c8d54f635feff4df76c2ca80f45332eb2ff57d25226edce36592e51a177ee33",
      "archive": "zip",
      "root": "node-v22.22.3-win-x64"
    }
  },
  "pythonSources": {
    "darwin-arm64": {
      "file": "cpython-3.12.14+20260901-aarch64-apple-darwin-install_only.tar.gz",
      "url": "https://github.com/astral-sh/python-build-standalone/releases/download/20260901/cpython-3.12.14%2B20260901-aarch64-apple-darwin-install_only.tar.gz",
      "sha256": "3ee3ee547cedfeb7c2b16b2b7156039f7b470bb8f857e226fd3d2eb11db83c76",
      "archive": "tar.gz",
      "root": "python"
    },
    "darwin-x64": {
      "file": "cpython-3.12.14+20260901-x86_64-apple-darwin-install_only.tar.gz",
      "url": "https://github.com/astral-sh/python-build-standalone/releases/download/20260901/cpython-3.12.14%2B20260901-x86_64-apple-darwin-install_only.tar.gz",
      "sha256": "2e31b23f3f1319f707d0e620b48847a0046577541d357276821f9f1b5492e0ba",
      "archive": "tar.gz",
      "root": "python"
    },
    "win32-x64": {
      "file": "cpython-3.12.14+20260901-x86_64-pc-windows-msvc-install_only.tar.gz",
      "url": "https://github.com/astral-sh/python-build-standalone/releases/download/20260901/cpython-3.12.14%2B20260901-x86_64-pc-windows-msvc-install_only.tar.gz",
      "sha256": "e90c1b6419da3bd812dd73bb3de40287a21abf153438147639ec5e20375ea93f",
      "archive": "tar.gz",
      "root": "python"
    }
  },
  "targetExclusions": {
    "darwin-arm64": ["@microsoft/powerbi-desktop-bridge-cli"],
    "darwin-x64": ["@microsoft/powerbi-desktop-bridge-cli"],
    "win32-x64": []
  }
}
